{
  "schema_version": "uaa-control-center-capability-surface.v1",
  "status": "active_capability_surface_coverage_seed_no_runtime_authority",
  "baseline": "v0.104.0 / 0.104.0",
  "scope": "operator-facing capabilities only; internal helper functions are out of scope",
  "route_status_manifest_ref": "docs/control_center/route_status_manifest.json",
  "release_surface_manifest_ref": "docs/control_center/release_surface_manifest.json",
  "ui_wiring_report_ref": "docs/control_center/UI_WIRING_REPORT.md",
  "api_manifest_ref": "/api/manifest",
  "status_vocabulary": [
    "ui_api_cli_wired",
    "partial_surface_coverage",
    "backend_or_cli_only",
    "mock_or_static_only",
    "blocked_intentionally"
  ],
  "runtime_authority_added": false,
  "public_beta_claim_enabled": false,
  "production_readiness_claim_enabled": false,
  "capabilities": [
    {
      "capability_id": "finance_synthetic_workspace",
      "label": "Finance protected synthetic review workflow",
      "python_core_owner": "src/ultimate_ai_agent/core/finance/workspace.py",
      "api_routes": [
        { "method": "GET", "path": "/control-center/finance/workspace", "operation_id": "get_control_center_finance_workspace" },
        { "method": "POST", "path": "/control-center/finance/workspace/preview", "operation_id": "preview_control_center_finance_workspace_mutation" },
        { "method": "POST", "path": "/control-center/finance/workspace/refresh", "operation_id": "refresh_control_center_finance_workspace_preparation" },
        { "method": "POST", "path": "/control-center/finance/workspace/commit", "operation_id": "commit_control_center_finance_workspace_mutation" }
      ],
      "cli_paths": ["scripts/dev/uaa_finance.py"],
      "ui_routes": ["/finance"],
      "control_action_ids": ["finance-synthetic-workspace-review"],
      "authority_posture": "fixed synthetic book and allowlisted sample import only; read and preview grant no authority; each mutation needs separate exact confirmation, policy, approval, lease, current source and safe-disable checks",
      "status": "partial_surface_coverage",
      "missing_reason": "Final synthetic-child qualification remains pending. Real financial data, categorization, rules, Windows native crypto and multi-computer continuity remain blocked; this does not complete FIN-003 or Q26.",
      "tests_evidence_refs": [
        "tests/test_fin003_workspace.py",
        "tests/test_fin003_workspace_api.py",
        "tests/test_fin003_workspace_cli.py",
        "docs/product/UAA_FINANCE_FIN003_SYNTHETIC_IN_APP_WORKFLOW.md"
      ]
    },
    {
      "capability_id": "start_here_read_model",
      "label": "Start Here local loop summary",
      "python_core_owner": "src/ultimate_ai_agent/core/control_center/start_here.py",
      "api_routes": [
        {
          "method": "GET",
          "path": "/control-center/start-here/summary",
          "operation_id": "get_control_center_start_here_summary"
        }
      ],
      "cli_paths": [],
      "ui_routes": [
        "/start"
      ],
      "control_action_ids": [
        "navigate-start-here"
      ],
      "authority_posture": "read-only local loop entry point; execution and external authority remain blocked",
      "status": "partial_surface_coverage",
      "missing_reason": "dedicated CLI inspection path is not present yet",
      "tests_evidence_refs": [
        "tests/test_control_center_start_here.py",
        "docs/control_center/CONTROL_CENTER_RELEASE_SURFACE.md"
      ]
    },
    {
      "capability_id": "today_daily_loop_summary",
      "label": "Today daily loop summary",
      "python_core_owner": "src/ultimate_ai_agent/core/storage/founder_loop.py",
      "api_routes": [
        {
          "method": "GET",
          "path": "/control-center/today/summary",
          "operation_id": "get_control_center_today_summary"
        }
      ],
      "cli_paths": [
        "scripts/inspect_today_loop.py",
        "scripts/dev/uaa_founder_loop.py"
      ],
      "ui_routes": [
        "/today"
      ],
      "control_action_ids": [
        "navigate-today"
      ],
      "authority_posture": "read-only storage-backed summary using safe refs and bounded summaries",
      "status": "ui_api_cli_wired",
      "missing_reason": "none",
      "tests_evidence_refs": [
        "tests/test_control_center_founder_loop_api.py",
        "tests/test_founder_loop_storage.py",
        "scripts/verify_uaa_p1_068_today_product_spine_contract.py"
      ]
    },
    {
      "capability_id": "messenger_fixture_preview",
      "label": "Messenger Matrix desktop fixture plus governed sync, crypto, messaging, rooms/media, intelligence, and hardening posture",
      "python_core_owner": "src/ultimate_ai_agent/core/communications",
      "api_routes": [
        {
          "method": "GET",
          "path": "/control-center/communications/matrix-sync/posture",
          "operation_id": "get_control_center_communications_matrix_sync_posture"
        },
        {
          "method": "GET",
          "path": "/control-center/communications/matrix-crypto/posture",
          "operation_id": "get_control_center_communications_matrix_crypto_posture"
        },
        {
          "method": "GET",
          "path": "/control-center/communications/matrix-messaging/posture",
          "operation_id": "get_control_center_communications_matrix_messaging_posture"
        },
        {
          "method": "GET",
          "path": "/control-center/communications/matrix-rooms-media/posture",
          "operation_id": "get_control_center_communications_matrix_rooms_media_posture"
        },
        {
          "method": "GET",
          "path": "/control-center/communications/matrix-intelligence/posture",
          "operation_id": "get_control_center_communications_matrix_intelligence_posture"
        },
        {
          "method": "GET",
          "path": "/control-center/communications/matrix-hardening/posture",
          "operation_id": "get_control_center_communications_matrix_hardening_posture"
        }
      ],
      "cli_paths": [
        "scripts/dev/uaa_communications.py"
      ],
      "ui_routes": [
        "/messenger"
      ],
      "control_action_ids": [
        "navigate-messenger"
      ],
      "authority_posture": "backend-owned content-free sync, crypto, messaging, rooms/media, intelligence, and hardening posture; MSG-MX-010 permits six exact request-scoped local policy/context/proposal operations, while MSG-MX-011 grants no new runtime lane and reports local hardening evidence plus explicit migration, multi-device, localization, and external-facility gaps",
      "status": "partial_surface_coverage",
      "missing_reason": "Live account configuration, protected UI message-content reads, persistent crypto composition, cache migration, persistent multi-device ownership, provider/model invocation, attachment analysis, automatic proposal generation, proposal execution, broader message sends, calls, remote homeservers, broad filesystem access, and standing connector authority remain blocked or later-phase work",
      "tests_evidence_refs": [
        "tests/test_msg_mx_002_static_shell.py",
        "tests/test_msg_mx_006_matrix_sync_authority.py",
        "tests/test_msg_mx_006_matrix_sync_api_cli.py",
        "tests/test_msg_mx_007_matrix_crypto_authority.py",
        "tests/test_msg_mx_008_matrix_messaging_api_cli.py",
        "tests/test_msg_mx_008_matrix_messaging_contracts.py",
        "tests/test_msg_mx_009_rooms_search_media_api_cli.py",
        "tests/test_msg_mx_009_rooms_search_media_contracts.py",
        "tests/test_msg_mx_010_intelligence_api_cli.py",
        "tests/test_msg_mx_010_intelligence_contracts.py",
        "tests/test_control_center_release_surface_manifest.py",
        "tests/test_control_center_capability_surface_manifest.py",
        "docs/design/control_center_north_star/UAA_MESSENGER_MATRIX_RENDER_ACCEPTANCE.md"
      ]
    },
    {
      "capability_id": "news_signals_backend_read_model",
      "label": "News & Signals founder-private local adoption",
      "python_core_owner": "src/ultimate_ai_agent/core/news_signals/adoption.py",
      "api_routes": [
        {
          "method": "GET",
          "path": "/control-center/news-signals/summary",
          "operation_id": "get_control_center_news_signals_summary"
        },
        {
          "method": "GET",
          "path": "/control-center/news-signals/adoption",
          "operation_id": "get_control_center_news_signals_adoption_workspace"
        },
        {
          "method": "POST",
          "path": "/control-center/news-signals/adoption/preview",
          "operation_id": "preview_control_center_news_signals_adoption_mutation"
        },
        {
          "method": "POST",
          "path": "/control-center/news-signals/adoption/approval",
          "operation_id": "capture_control_center_news_signals_adoption_approval"
        },
        {
          "method": "POST",
          "path": "/control-center/news-signals/adoption/commit",
          "operation_id": "commit_control_center_news_signals_adoption_mutation"
        }
      ],
      "cli_paths": [
        "scripts/inspect_news_signals.py",
        "scripts/inspect_news_signals_adoption.py"
      ],
      "ui_routes": [
        "/news"
      ],
      "control_action_ids": [
        "navigate-news-signals"
      ],
      "authority_posture": "backend-owned founder-private local source and already-redacted artifact adoption with exact approval, idempotency, operation-budget-one workspace/write lease, receipts, archive/recovery, source safe-disable/recovery, preferences, undo, and bounded Today/Morning Briefing projections; live source access, account authentication, background polling, model summarization, connector writes, recommendations, and actions remain blocked",
      "status": "ui_api_cli_wired",
      "missing_reason": "none",
      "tests_evidence_refs": [
        "tests/test_queue_v2_q24_news_signals.py",